,text
43,Teaching Models to Express Their Uncertainty in Words We show that a GPT model can learn to express uncertainty about its ownanswers in natural language  without use of model logits. When given aquestion the model generates both an answer and a level of confidence e.g. confidence or high confidence. These levels map to probabilities thatare well calibrated. The model also remains moderately calibrated underdistribution shift and is sensitive to uncertainty in its own answers ratherthan imitating human examples. To our knowledge this is the first time a modelhas been shown to express calibrated uncertainty about its own answers innatural language. For testing calibration we introduce the CalibratedMathsuite of tasks. We compare the calibration of uncertainty expressed in wordsverbalized probability to uncertainty extracted from model logits. Bothkinds of uncertainty are capable of generalizing calibration under distributionshift. We also provide evidence that GPTs ability to generalize calibrationdepends on pretrained latent representations that correlate with epistemicuncertainty over its answers.
44,Missingness Bias in Model Debugging Missingness or the absence of features from an input is a conceptfundamental to many model debugging tools. However in computer vision pixelscannot simply be removed from an image. One thus tends to resort to heuristicssuch as blacking out pixels which may in turn introduce bias into thedebugging process. We study such biases and in particular show howtransformerbased architectures can enable a more natural implementation ofmissingness which sidesteps these issues and improves the reliability ofmodel debugging in practice. Our code is available at
45,SingleTurn Debate Does Not Help Humans Answer Hard ReadingComprehension Questions Current QA systems can generate reasonablesounding yet false answers withoutexplanation or evidence for the generated answer which is especiallyproblematic when humans cannot readily check the models answers. This presentsa challenge for building trust in machine learning systems. We take inspirationfrom realworld situations where difficult questions are answered byconsidering opposing sides see Irving et al. . For multiplechoice QAexamples we build a dataset of single arguments for both a correct andincorrect answer option in a debatestyle setup as an initial step in trainingmodels to produce explanations for two candidate answers. We use long contexts humans familiar with the context write convincing explanations forpreselected correct and incorrect answers and we test if those explanationsallow humans who have not read the full context to more accurately determinethe correct answer. We do not find that explanations in our setup improvehuman accuracy but a baseline condition shows that providing humanselectedtext snippets does improve accuracy. We use these findings to suggest ways ofimproving the debate set up for future data collection efforts.
46,A geometric framework for outlier detection in highdimensional data Outlier or anomaly detection is an important task in data analysis. Wediscuss the problem from a geometrical perspective and provide a framework thatexploits the metric structure of a data set. Our approach rests on the manifoldassumption i.e. that the observed nominally highdimensional data lie on amuch lower dimensional manifold and that this intrinsic structure can beinferred with manifold learning methods. We show that exploiting this structuresignificantly improves the detection of outlying observations inhighdimensional data. We also suggest a novel mathematically precise andwidely applicable distinction between distributional and structural outliersbased on the geometry and topology of the data manifold that clarifiesconceptual ambiguities prevalent throughout the literature. Our experimentsfocus on functional data as one class of structured highdimensional data butthe framework we propose is completely general and we include image and graphdata applications. Our results show that the outlier structure ofhighdimensional and nontabular data can be detected and visualized usingmanifold learning methods and quantified using standard outlier scoring methodsapplied to the manifold embedding vectors.
47,Exemplary Natural Images Explain CNN Activations Better than StateoftheArt Feature Visualization Feature visualizations such as synthetic maximally activating images are awidely used explanation method to better understand the information processingof convolutional neural networks CNNs. At the same time there are concernsthat these visualizations might not accurately represent CNNs inner workings.Here we measure how much extremely activating images help humans to predictCNN activations. Using a wellcontrolled psychophysical paradigm we comparethe informativeness of synthetic images by Olah et al.  with a simplebaseline visualization namely exemplary natural images that also stronglyactivate a specific feature map. Given either synthetic or natural referenceimages human participants choose which of two query images leads to strongpositive activation. The experiments are designed to maximize participantsperformance and are the first to probe intermediate instead of final layerrepresentations. We find that synthetic images indeed provide helpfulinformation about feature map activations pm accuracy chance would be. However natural images  originally intended as a baseline outperform synthetic images by a wide margin pm. Additionallyparticipants are faster and more confident for natural images whereassubjective impressions about the interpretability of the feature visualizationsare mixed. The higher informativeness of natural images holds across mostlayers for both expert and lay participants as well as for hand andrandomlypicked feature visualizations. Even if only a single reference imageis given synthetic images provide less information than natural imagespm vs. pm. In summary synthetic images from a popularfeature visualization method are significantly less informative for assessingCNN activations than natural images. We argue that visualization methods shouldimprove over this baseline.
