text,label
Mean field Variational Inference via Wasserstein Gradient Flow Variational inference  VI  provides an appealing alternative to traditional sampling based approaches for implementing Bayesian inference due to its conceptual simplicity  statistical accuracy and computational scalability. However  common variational approximation schemes  such as the mean field  MF  approximation  require certain conjugacy structure to facilitate efficient computation  which may add unnecessary restrictions to the viable prior distribution family and impose further constraints on the variational approximation family. In this work  we develop a general computational framework for implementing MF VI via Wasserstein gradient flow  WGF   a gradient flow over the space of probability measures. When specialized to Bayesian latent variable models  we analyze the algorithmic convergence of an alternating minimization scheme based on a time discretized WGF for implementing the MF approximation. In particular  the proposed algorithm resembles a distributional version of EM algorithm  consisting of an E step of updating the latent variable variational distribution and an M step of conducting steepest descent over the variational distribution of parameters. Our theoretical analysis relies on optimal transport theory and subdifferential calculus in the space of probability measures. We prove the exponential convergence of the time discretized WGF for minimizing a generic objective functional given strict convexity along generalized geodesics. We also provide a new proof of the exponential contraction of the variational distribution obtained from the MF approximation by using the fixed point equation of the time discretized WGF. We apply our method and theory to two classic Bayesian latent variable models  the Gaussian mixture model and the mixture of regression model. Numerical experiments are also conducted to compliment the theoretical findings under these two models.,1
Graph Neural Network Bandits We consider the bandit optimization problem with the reward function defined over graph structured data.,1
Semantic uncertainty intervals for disentangled latent spaces Meaningful uncertainty quantification in computer vision requires reasoning about semantic information    say  the hair color of the person in a photo or the location of a car on the street. To this end  recent breakthroughs in generative modeling allow us to represent semantic information in disentangled latent spaces  but providing uncertainties on the semantic latent variables has remained challenging. In this work  we provide principled uncertainty intervals that are guaranteed to contain the true semantic factors for any underlying generative model. The method does the following      it uses quantile regression to output a heuristic uncertainty interval for each element in the latent space     calibrates these uncertainties such that they contain the true value of the latent for a new  unseen input. The endpoints of these calibrated intervals can then be propagated through the generator to produce interpretable uncertainty visualizations for each semantic factor. This technique reliably communicates semantically meaningful  principled  and instance adaptive uncertainty in inverse problems like image super resolution and image completion.,1
Generalized Identifiability Bounds for Mixture Models with Grouped Samples Recent work has shown that finite mixture models with  m  components are identifiable  while making no assumptions on the mixture components  so long as one has access to groups of samples of size   m    which are known to come from the same mixture component. In this work we generalize that result and show that  if every subset of  k  mixture components of a mixture model are linearly independent  then that mixture model is identifiable with only    m     k     samples per group. We further show that this value cannot be improved. We prove an analogous result for a stronger form of identifiability known as  determinedness  along with a corresponding lower bound. This independence assumption almost surely holds if mixture components are chosen randomly from a  k  dimensional space. We describe some implications of our results for multinomial mixture models and topic modeling.,1
The derivatives of Sinkhorn Knopp converge We show that the derivatives of the Sinkhorn Knopp algorithm  or iterative proportional fitting procedure  converge towards the derivatives of the entropic regularization of the optimal transport problem with a locally uniform linear convergence rate.,1
Estimating value at risk  LSTM vs. GARCH Estimating value at risk on time series data with possibly heteroscedastic dynamics is a highly challenging task. Typically  we face a small data problem in combination with a high degree of non linearity  causing difficulties for both classical and machine learning estimation algorithms. In this paper  we propose a novel value at risk estimator using a long short term memory  LSTM  neural network and compare its performance to benchmark GARCH estimators.,1
Volatility Based Kernels and Moving Average Means for Accurate Forecasting with Gaussian Processes A broad class of stochastic volatility models are defined by systems of stochastic differential equations. While these models have seen widespread success in domains such as finance and statistical climatology  they typically lack an ability to condition on historical data to produce a true posterior distribution. To address this fundamental limitation  we show how to re cast a class of stochastic volatility models as a hierarchical Gaussian process  GP  model with specialized covariance functions. This GP model retains the inductive biases of the stochastic volatility model while providing the posterior predictive distribution given by GP inference. Within this framework  we take inspiration from well studied domains to introduce a new class of models  Volt and Magpie  that significantly outperform baselines in stock and wind speed forecasting  and naturally extend to the multitask setting.,1
Comparing Feature Importance and Rule Extraction for Interpretability on Text Data Complex machine learning algorithms are used more and more often in critical tasks involving text data  leading to the development of interpretability methods. Among local methods  two families have emerged  those computing importance scores for each feature and those extracting simple logical rules. In this paper we show that using different methods can lead to unexpectedly different explanations  even when applied to simple models for which we would expect qualitative coincidence. To quantify this effect  we propose a new approach to compare explanations produced by different methods.,1
Look beyond labels  Incorporating functional summary information in Bayesian neural networks Bayesian deep learning offers a principled approach to train neural networks that accounts for both aleatoric and epistemic uncertainty. In variational inference  priors are often specified over the weight parameters  but they do not capture the true prior knowledge in large and complex neural network architectures. We present a simple approach to incorporate summary information about the predicted probability  such as sigmoid or softmax score  outputs in Bayesian neural networks  BNNs . The available summary information is incorporated as augmented data and modeled with a Dirichlet process  and we derive the corresponding  emph Summary Evidence Lower BOund . We show how the method can inform the model about task difficulty or class imbalance. Extensive empirical experiments show that  with negligible computational overhead  the proposed method yields a BNN with a better calibration of uncertainty.,1
Edge Augmentation on Disconnected Graphs via Eigenvalue Elevation The graph theoretical task of determining most likely inter community edges based on disconnected subgraphs  intra community connectivity is proposed. An algorithm is developed for this edge augmentation task  based on elevating the zero eigenvalues of graph s spectrum. Upper bounds for eigenvalue elevation amplitude and for the corresponding augmented edge density are derived and are authenticated with simulation on random graphs. The algorithm works consistently across synthetic and real networks  yielding desirable performance at connecting graph components. Edge augmentation reverse engineers graph partition under different community detection methods  Girvan Newman method  greedy modularity maximization  label propagation  Louvain method  and fluid community   in most cases producing inter community edges at      frequency.,1
pGMM Kernel Regression and Comparisons with Boosted Trees In this work  we demonstrate the advantage of the pGMM    powered generalized min max    kernel in the context of  ridge  regression. In recent prior studies  the pGMM kernel has been extensively evaluated for classification tasks  for logistic regression  support vector machines  as well as deep neural networks. In this paper  we provide an experimental study on ridge regression  to compare the pGMM kernel regression with the ordinary ridge linear regression as well as the RBF kernel ridge regression. Perhaps surprisingly  even without a tuning parameter  i.e.   p    for the power parameter of the pGMM kernel   the pGMM kernel already performs well. Furthermore  by tuning the parameter  p   this  deceptively simple  pGMM kernel even performs quite comparably to boosted trees.,1
Contextual Bandits with Smooth Regret  Efficient Learning in Continuous Action Spaces Designing efficient general purpose contextual bandit algorithms that work with large    or even continuous    action spaces would facilitate application to important scenarios such as information retrieval  recommendation systems  and continuous control. While obtaining standard regret guarantees can be hopeless  alternative regret notions have been proposed to tackle the large action setting. We propose a smooth regret notion for contextual bandits  which dominates previously proposed alternatives. We design a statistically and computationally efficient algorithm    for the proposed smooth regret    that works with general function approximation under standard supervised oracles. We also present an adaptive algorithm that automatically adapts to any smoothness level. Our algorithms can be used to recover the previous minimax Pareto optimal guarantees under the standard regret  e.g.  in bandit problems with multiple best arms and Lipschitz H   lder bandits. We conduct large scale empirical evaluations demonstrating the efficacy of our proposed algorithms.,1
Local manifold learning and its link to domain based physics knowledge In many reacting flow systems  the thermo chemical state space is known or assumed to evolve close to a low dimensional manifold  LDM . Various approaches are available to obtain those manifolds and subsequently express the original high dimensional space with fewer parameterizing variables. Principal component analysis  PCA  is one of the dimensionality reduction methods that can be used to obtain LDMs. PCA does not make prior assumptions about the parameterizing variables and retrieves them empirically from the training data. In this paper  we show that PCA applied in local clusters of data  local PCA  is capable of detecting the intrinsic parameterization of the thermo chemical state space. We first demonstrate that utilizing three common combustion models of varying complexity  the Burke Schumann model  the chemical equilibrium model and the homogeneous reactor. Parameterization of these models is known a priori which allows for benchmarking with the local PCA approach. We further extend the application of local PCA to a more challenging case of a turbulent non premixed  n  heptane air jet flame for which the parameterization is no longer obvious. Our results suggest that meaningful parameterization can be obtained also for more complex datasets. We show that local PCA finds variables that can be linked to local stoichiometry  reaction progress and soot formation processes.,1
On the instrumental variable estimation with many weak and invalid instruments We discuss the fundamental issue of identification in linear instrumental variable  IV  models with unknown IV validity. We revisit the popular majority and plurality rules and show that no identification condition can be  if and only if  in general. With the assumption of the  sparsest rule   which is equivalent to the plurality rule but becomes operational in computation algorithms  we investigate and prove the advantages of non convex penalized approaches over other IV estimators based on two step selections  in terms of selection consistency and accommodation for individually weak IVs. Furthermore  we propose a surrogate sparsest penalty that aligns with the identification condition and provides oracle sparse structure simultaneously. Desirable theoretical properties are derived for the proposed estimator with weaker IV strength conditions compared to the previous literature. Finite sample properties are demonstrated using simulations and the selection and estimation method is applied to an empirical study concerning the effect of trade on economic growth.,1
BR SNIS  Bias Reduced Self Normalized Importance Sampling Importance Sampling  IS  is a method for approximating expectations under a target distribution using independent samples from a proposal distribution and the associated importance weights. In many applications  the target distribution is known only up to a normalization constant  in which case self normalized IS  SNIS  can be used. While the use of self normalization can have a positive effect on the dispersion of the estimator  it introduces bias. In this work  we propose a new method  BR SNIS  whose complexity is essentially the same as that of SNIS and which significantly reduces bias without increasing the variance. This method is a wrapper in the sense that it uses the same proposal samples and importance weights as SNIS  but makes clever use of iterated sampling  importance resampling  ISIR  to form a bias reduced version of the estimator. We furnish the proposed algorithm with rigorous theoretical results  including new bias  variance and high probability bounds  and these are illustrated by numerical examples.,1
Uncertainty Aware Learning Against Label Noise on Imbalanced Datasets Learning against label noise is a vital topic to guarantee a reliable performance for deep neural networks. Recent research usually refers to dynamic noise modeling with model output probabilities and loss values  and then separates clean and noisy samples. These methods have gained notable success. However  unlike cherry picked data  existing approaches often cannot perform well when facing imbalanced datasets  a common scenario in the real world. We thoroughly investigate this phenomenon and point out two major issues that hinder the performance  i.e.   emph inter class loss distribution discrepancy  and  emph misleading predictions due to uncertainty . The first issue is that existing methods often perform class agnostic noise modeling. However  loss distributions show a significant discrepancy among classes under class imbalance  and class agnostic noise modeling can easily get confused with noisy samples and samples in minority classes. The second issue refers to that models may output misleading predictions due to epistemic uncertainty and aleatoric uncertainty  thus existing methods that rely solely on the output probabilities may fail to distinguish confident samples. Inspired by our observations  we propose an Uncertainty aware Label Correction framework  ULC  to handle label noise on imbalanced datasets. First  we perform epistemic uncertainty aware class specific noise modeling to identify trustworthy clean samples and refine discard highly confident true corrupted labels. Then  we introduce aleatoric uncertainty in the subsequent learning process to prevent noise accumulation in the label noise modeling process. We conduct experiments on several synthetic and real world datasets. The results demonstrate the effectiveness of the proposed method  especially on imbalanced datasets.,1
Plex  Towards Reliability using Pretrained Large Model Extensions A recent trend in artificial intelligence is the use of pretrained models for language and vision tasks  which have achieved extraordinary performance but also puzzling failures. Probing these models  abilities in diverse ways is therefore critical to the field. In this paper  we explore the reliability of models  where we define a reliable model as one that not only achieves strong predictive performance but also performs well consistently over many decision making tasks involving uncertainty  e.g.  selective prediction  open set recognition   robust generalization  e.g.  accuracy and proper scoring rules such as log likelihood on in  and out of distribution datasets   and adaptation  e.g.  active learning  few shot uncertainty . We devise    types of tasks over    datasets in order to evaluate different aspects of reliability on both vision and language domains. To improve reliability  we developed ViT Plex and T  Plex  pretrained large model extensions for vision and language modalities  respectively. Plex greatly improves the state of the art across reliability tasks  and simplifies the traditional protocol as it improves the out of the box performance and does not require designing scores or tuning the model for each task. We demonstrate scaling effects over model sizes up to  B parameters and pretraining dataset sizes up to  B examples. We also demonstrate Plex s capabilities on challenging tasks including zero shot open set recognition  active learning  and uncertainty in conversational language understanding.,1
Off the grid learning of sparse mixtures from a continuous dictionary We consider a general non linear model where the signal is a finite mixture of an unknown  possibly increasing  number of features issued from a continuous dictionary parameterized by a real nonlinear parameter. The signal is observed with Gaussian  possibly correlated  noise in either a continuous or a discrete setup. We propose an off the grid optimization method  that is  a method which does not use any discretization scheme on the parameter space  to estimate both the non linear parameters of the features and the linear parameters of the mixture. We use recent results on the geometry of off the grid methods to give minimal separation on the true underlying non linear parameters such that interpolating certificate functions can be constructed. Using also tail bounds for suprema of Gaussian processes we bound the prediction error with high probability. Assuming that the certificate functions can be constructed  our prediction error bound is up to log   factors similar to the rates attained by the Lasso predictor in the linear regression model. We also establish convergence rates that quantify with high probability the quality of estimation for both the linear and the non linear parameters.,1
Rewiring Networks for Graph Neural Network Training Using Discrete Geometry Information over squashing is a phenomenon of inefficient information propagation between distant nodes on networks. It is an important problem that is known to significantly impact the training of graph neural networks  GNNs   as the receptive field of a node grows exponentially. To mitigate this problem  a preprocessing procedure known as rewiring is often applied to the input network. In this paper  we investigate the use of discrete analogues of classical geometric notions of curvature to model information flow on networks and rewire them. We show that these classical notions achieve state of the art performance in GNN training accuracy on a variety of real world network datasets. Moreover  compared to the current state of the art  these classical notions exhibit a clear advantage in computational runtime by several orders of magnitude.,1
Data Driven Stochastic AC OPF using Gaussian Processes In recent years  electricity generation has been responsible for more than a quarter of the greenhouse gas emissions in the US. Integrating a significant amount of renewables into a power grid is probably the most accessible way to reduce carbon emissions from power grids and slow down climate change. Unfortunately  the most accessible renewable power sources  such as wind and solar  are highly fluctuating and thus bring a lot of uncertainty to power grid operations and challenge existing optimization and control policies. The chance constrained alternating current  AC  optimal power flow  OPF  framework finds the minimum cost generation dispatch maintaining the power grid operations within security limits with a prescribed probability. Unfortunately  the AC OPF problem s chance constrained extension is non convex  computationally challenging  and requires knowledge of system parameters and additional assumptions on the behavior of renewable distribution. Known linear and convex approximations to the above problems  though tractable  are too conservative for operational practice and do not consider uncertainty in system parameters. This paper presents an alternative data driven approach based on Gaussian process  GP  regression to close this gap. The GP approach learns a simple yet non convex data driven approximation to the AC power flow equations that can incorporate uncertainty inputs. The latter is then used to determine the solution of CC OPF efficiently  by accounting for both input and parameter uncertainty. The practical efficiency of the proposed approach using different approximations for GP uncertainty propagation is illustrated over numerous IEEE test cases.,1
Unsupervised learning of observation functions in state space models by nonparametric moment methods We investigate the unsupervised learning of non invertible observation functions in nonlinear state space models. Assuming abundant data of the observation process along with the distribution of the state process  we introduce a nonparametric generalized moment method to estimate the observation function via constrained regression. The major challenge comes from the non invertibility of the observation function and the lack of data pairs between the state and observation. We address the fundamental issue of identifiability from quadratic loss functionals and show that the function space of identifiability is the closure of a RKHS that is intrinsic to the state process. Numerical results show that the first two moments and temporal correlations  along with upper and lower bounds  can identify functions ranging from piecewise polynomials to smooth functions  leading to convergent estimators. The limitations of this method  such as non identifiability due to symmetry and stationarity  are also discussed.,1
ManiFeSt  Manifold based Feature Selection for Small Data Sets In this paper  we present a new method for few sample supervised feature selection  FS . Our method first learns the manifold of the feature space of each class using kernels capturing multi feature associations. Then  based on Riemannian geometry  a composite kernel is computed  extracting the differences between the learned feature associations. Finally  a FS score based on spectral analysis is proposed. Considering multi feature associations makes our method multivariate by design. This in turn allows for the extraction of the hidden manifold underlying the features and avoids overfitting  facilitating few sample FS. We showcase the efficacy of our method on illustrative examples and several benchmarks  where our method demonstrates higher accuracy in selecting the informative features compared to competing methods. In addition  we show that our FS leads to improved classification and better generalization when applied to test data.,1
TCT  Convexifying Federated Learning using Bootstrapped Neural Tangent Kernels State of the art federated learning methods can perform far worse than their centralized counterparts when clients have dissimilar data distributions. For neural networks  even when centralized SGD easily finds a solution that is simultaneously performant for all clients  current federated optimization methods fail to converge to a comparable solution. We show that this performance disparity can largely be attributed to optimization challenges presented by nonconvexity. Specifically  we find that the early layers of the network do learn useful features  but the final layers fail to make use of them. That is  federated optimization applied to this non convex problem distorts the learning of the final layers. Leveraging this observation  we propose a Train Convexify Train  TCT  procedure to sidestep this issue  first  learn features using off the shelf methods  e.g.  FedAvg   then  optimize a convexified problem obtained from the network s empirical neural tangent kernel approximation. Our technique yields accuracy improvements of up to      on FMNIST and      on CIFAR   when clients have dissimilar data.,1
