text,label
Models Out of Line  A Fourier Lens on Distribution Shift Robustness Improving the accuracy of deep neural networks  DNNs  on out of distribution  OOD  data is critical to an acceptance of deep learning  DL  in real world applications. It has been observed that accuracies on in distribution  ID  versus OOD data follow a linear trend and models that outperform this baseline are exceptionally rare  and referred to as  effectively robust  . Recently  some promising approaches have been developed to improve OOD robustness  model pruning  data augmentation  and ensembling or zero shot evaluating large pretrained models. However  there still is no clear understanding of the conditions on OOD data and model properties that are required to observe effective robustness. We approach this issue by conducting a comprehensive empirical study of diverse approaches that are known to impact OOD robustness on a broad range of natural and synthetic distribution shifts of CIFAR    and ImageNet. In particular  we view the  effective robustness puzzle  through a Fourier lens and ask how spectral properties of both models and OOD data influence the corresponding effective robustness. We find this Fourier lens offers some insight into why certain robust models  particularly those from the CLIP family  achieve OOD robustness. However  our analysis also makes clear that no known metric is consistently the best explanation  or even a strong explanation  of OOD robustness. Thus  to aid future research into the OOD puzzle  we address the gap in publicly available models with effective robustness by introducing a set of pretrained models  RobustNets  with varying levels of OOD robustness.,0
Distinction Maximization Loss  Efficiently Improving Classification Accuracy  Uncertainty Estimation  and Out of Distribution Detection Simply Replacing the Loss and Calibrating Building robust deterministic neural networks remains a challenge. On the one hand  some approaches improve out of distribution detection at the cost of reducing classification accuracy in some situations. On the other hand  some methods simultaneously increase classification accuracy  uncertainty estimation  and out of distribution detection at the expense of reducing the inference efficiency and requiring training the same model many times to tune hyperparameters. In this paper  we propose training deterministic neural networks using our DisMax loss  which works as a drop in replacement for the usual SoftMax loss  i.e.  the combination of the linear output layer  the SoftMax activation  and the cross entropy loss . Starting from the IsoMax  loss  we create each logit based on the distances to all prototypes rather than just the one associated with the correct class. We also introduce a mechanism to combine images to construct what we call fractional probability regularization. Moreover  we present a fast way to calibrate the network after training. Finally  we propose a composite score to perform out of distribution detection. Our experiments show that DisMax usually outperforms current approaches simultaneously in classification accuracy  uncertainty estimation  and out of distribution detection while maintaining deterministic neural network inference efficiency and avoiding training the same model repetitively for hyperparameter tuning. The code to reproduce the results is available at,0
Can Rationalization Improve Robustness  A growing line of work has investigated the development of neural NLP models that can produce rationales  subsets of input that can explain their model predictions. In this paper  we ask whether such rationale models can also provide robustness to adversarial attacks in addition to their interpretable nature. Since these models need to first generate rationales   rationalizer   before making predictions   predictor    they have the potential to ignore noise or adversarially added text by simply masking it out of the generated rationale. To this end  we systematically generate various types of  AddText  attacks for both token and sentence level rationalization tasks  and perform an extensive empirical evaluation of state of the art rationale models across five different tasks. Our experiments reveal that the rationale models show the promise to improve robustness  while they struggle in certain scenarios  when the rationalizer is sensitive to positional bias or lexical choices of attack text. Further  leveraging human rationale as supervision does not always translate to better performance. Our study is a first step towards exploring the interplay between interpretability and robustness in the rationalize then predict framework.,0
Natural Adversarial Examples We introduce two challenging datasets that reliably cause machine learning model performance to substantially degrade. The datasets are collected with a simple adversarial filtration technique to create datasets with limited spurious cues. Our datasets  real world  unmodified examples transfer to various unseen models reliably  demonstrating that computer vision models have shared weaknesses. The first dataset is called ImageNet A and is like the ImageNet test set  but it is far more challenging for existing models. We also curate an adversarial out of distribution detection dataset called ImageNet O  which is the first out of distribution detection dataset created for ImageNet models. On ImageNet A a DenseNet     obtains around    accuracy  an accuracy drop of approximately      and its out of distribution detection performance on ImageNet O is near random chance levels. We find that existing data augmentation techniques hardly boost performance  and using other public training datasets provides improvements that are limited. However  we find that improvements to computer vision architectures provide a promising path towards robust models.,0
Probable Domain Generalization via Quantile Risk Minimization Domain generalization  DG  seeks predictors which perform well on unseen test distributions by leveraging labeled training data from multiple related distributions or domains. To achieve this  the standard formulation optimizes for worst case performance over the set of all possible domains. However  with worst case shifts very unlikely in practice  this generally leads to overly conservative solutions. In fact  a recent study found that no DG algorithm outperformed empirical risk minimization in terms of average performance. In this work  we argue that DG is neither a worst case problem nor an average case problem  but rather a probabilistic one. To this end  we propose a probabilistic framework for DG  which we call Probable Domain Generalization  wherein our key idea is that distribution shifts seen during training should inform us of probable shifts at test time. To realize this  we explicitly relate training and test domains as draws from the same underlying meta distribution  and propose a new optimization problem    Quantile Risk Minimization  QRM     which requires that predictors generalize with high probability. We then prove that QRM   i  produces predictors that generalize to new domains with a desired probability  given sufficiently many domains and samples  and  ii  recovers the causal predictor as the desired probability of generalization approaches one. In our experiments  we introduce a more holistic quantile focused evaluation protocol for DG  and show that our algorithms outperform state of the art baselines on real and synthetic data.,0
Benchmarking Neural Network Robustness to Common Corruptions and Perturbations In this paper we establish rigorous benchmarks for image classifier robustness. Our first benchmark  ImageNet C  standardizes and expands the corruption robustness topic  while showing which classifiers are preferable in safety critical applications. Then we propose a new dataset called ImageNet P which enables researchers to benchmark a classifier s robustness to common perturbations. Unlike recent robustness research  this benchmark evaluates performance on common corruptions and perturbations not worst case adversarial perturbations. We find that there are negligible changes in relative corruption robustness from AlexNet classifiers to ResNet classifiers. Afterward we discover ways to enhance corruption and perturbation robustness. We even find that a bypassed adversarial defense provides substantial common perturbation robustness. Together our benchmarks may aid future work toward networks that robustly generalize.,0
Agreement on the Line  Predicting the Performance of Neural Networks under Distribution Shift Recently  Miller et al. showed that a model s in distribution  ID  accuracy has a strong linear correlation with its out of distribution  OOD  accuracy on several OOD benchmarks    a phenomenon they dubbed   accuracy on the line  . While a useful tool for model selection  i.e.  the model most likely to perform the best OOD is the one with highest ID accuracy   this fact does not help estimate the actual OOD performance of models without access to a labeled OOD validation set. In this paper  we show a similar but surprising phenomenon also holds for the agreement between pairs of neural network classifiers  whenever accuracy on the line holds  we observe that the OOD agreement between the predictions of any two pairs of neural networks  with potentially different architectures  also observes a strong linear correlation with their ID agreement. Furthermore  we observe that the slope and bias of OOD vs ID agreement closely matches that of OOD vs ID accuracy. This phenomenon  which we call agreement on the line  has important practical applications  without any labeled data  we can predict the OOD accuracy of classifiers   since OOD agreement can be estimated with just unlabeled data. Our prediction algorithm outperforms previous methods both in shifts where agreement on the line holds and  surprisingly  when accuracy is not on the line. This phenomenon also provides new insights into deep neural networks  unlike accuracy on the line  agreement on the line appears to only hold for neural network classifiers.,0
Certified Defenses against Adversarial Examples While neural networks have achieved high accuracy on standard image classification benchmarks  their accuracy drops to nearly zero in the presence of small adversarial perturbations to test inputs. Defenses based on regularization and adversarial training have been proposed  but often followed by new  stronger attacks that defeat these defenses. Can we somehow end this arms race  In this work  we study this problem for neural networks with one hidden layer. We first propose a method based on a semidefinite relaxation that outputs a certificate that for a given network and test input  no attack can force the error to exceed a certain value. Second  as this certificate is differentiable  we jointly optimize it with the network parameters  providing an adaptive regularizer that encourages robustness against all attacks. On MNIST  our approach produces a network and a certificate that no attack that perturbs each pixel by at most  epsilon    .  can cause more than     test error.,0
Data Augmentation Can Improve Robustness Adversarial training suffers from robust overfitting  a phenomenon where the robust test accuracy starts to decrease during training. In this paper  we focus on reducing robust overfitting by using common data augmentation schemes. We demonstrate that  contrary to previous findings  when combined with model weight averaging  data augmentation can significantly boost robust accuracy. Furthermore  we compare various augmentations techniques and observe that spatial composition techniques work the best for adversarial training. Finally  we evaluate our approach on CIFAR    against   ell  infty  and   ell    norm bounded perturbations of size   epsilon          and   epsilon             respectively. We show large absolute improvements of   .    and   .    in robust accuracy compared to previous state of the art methods. In particular  against   ell  infty  norm bounded perturbations of size   epsilon           our model reaches   .    robust accuracy without using any external data. We also achieve a significant performance boost with this approach while using other architectures and datasets such as CIFAR      SVHN and TinyImageNet.,0
GSmooth  Certified Robustness against Semantic Transformations via Generalized Randomized Smoothing Certified defenses such as randomized smoothing have shown promise towards building reliable machine learning systems against   ell p  norm bounded attacks. However  existing methods are insufficient or unable to provably defend against semantic transformations  especially those without closed form expressions  such as defocus blur and pixelate   which are more common in practice and often unrestricted. To fill up this gap  we propose generalized randomized smoothing  GSmooth   a unified theoretical framework for certifying robustness against general semantic transformations via a novel dimension augmentation strategy. Under the GSmooth framework  we present a scalable algorithm that uses a surrogate image to image network to approximate the complex transformation. The surrogate model provides a powerful tool for studying the properties of semantic transformations and certifying robustness. Experimental results on several datasets demonstrate the effectiveness of our approach for robustness certification against multiple kinds of semantic transformations and corruptions  which is not achievable by the alternative baselines.,0
Gradient based Adversarial Attacks against Text Transformers We propose the first general purpose gradient based attack against transformer models. Instead of searching for a single adversarial example  we search for a distribution of adversarial examples parameterized by a continuous valued matrix  hence enabling gradient based optimization. We empirically demonstrate that our white box attack attains state of the art attack performance on a variety of natural language tasks. Furthermore  we show that a powerful black box transfer attack  enabled by sampling from the adversarial distribution  matches or exceeds existing methods  while only requiring hard label outputs.,0
A law of adversarial risk  interpolation  and label noise In supervised learning  it has been shown that label noise in the data can be interpolated without penalties on test accuracy under many circumstances. We show that interpolating label noise induces adversarial vulnerability  and prove the first theorem showing the dependence of label noise and adversarial risk in terms of the data distribution. Our results are almost sharp without accounting for the inductive bias of the learning algorithm. We also show that inductive bias makes the effect of label noise much stronger.,0
Demystifying the Adversarial Robustness of Random Transformation Defenses Neural networks  lack of robustness against attacks raises concerns in security sensitive settings such as autonomous vehicles. While many countermeasures may look promising  only a few withstand rigorous evaluation. Defenses using random transformations  RT  have shown impressive results  particularly BaRT  Raff et al.        on ImageNet. However  this type of defense has not been rigorously evaluated  leaving its robustness properties poorly understood. Their stochastic properties make evaluation more challenging and render many proposed attacks on deterministic models inapplicable. First  we show that the BPDA attack  Athalye et al.      a  used in BaRT s evaluation is ineffective and likely overestimates its robustness. We then attempt to construct the strongest possible RT defense through the informed selection of transformations and Bayesian optimization for tuning their parameters. Furthermore  we create the strongest possible attack to evaluate our RT defense. Our new attack vastly outperforms the baseline  reducing the accuracy by     compared to the     reduction by the commonly used EoT attack    .  times  improvement . Our result indicates that the RT defense on the Imagenette dataset  a ten class subset of ImageNet  is not robust against adversarial examples. Extending the study further  we use our new attack to adversarially train RT defense  called AdvRT   resulting in a large robustness gain. Code is available at,0
WILDS  A Benchmark of in the Wild Distribution Shifts Distribution shifts    where the training distribution differs from the test distribution    can substantially degrade the accuracy of machine learning  ML  systems deployed in the wild. Despite their ubiquity in the real world deployments  these distribution shifts are under represented in the datasets widely used in the ML community today. To address this gap  we present WILDS  a curated benchmark of    datasets reflecting a diverse range of distribution shifts that naturally arise in real world applications  such as shifts across hospitals for tumor identification  across camera traps for wildlife monitoring  and across time and location in satellite imaging and poverty mapping. On each dataset  we show that standard training yields substantially lower out of distribution than in distribution performance. This gap remains even with models trained by existing methods for tackling distribution shifts  underscoring the need for new methods for training models that are more robust to the types of distribution shifts that arise in practice. To facilitate method development  we provide an open source package that automates dataset loading  contains default model architectures and hyperparameters  and standardizes evaluations. Code and leaderboards are available at,0
Intrinsic dimension estimation for discrete metrics Real world datasets characterized by discrete features are ubiquitous  from categorical surveys to clinical questionnaires  from unweighted networks to DNA sequences. Nevertheless  the most common unsupervised dimensional reduction methods are designed for continuous spaces  and their use for discrete spaces can lead to errors and biases. In this letter we introduce an algorithm to infer the intrinsic dimension  ID  of datasets embedded in discrete spaces. We demonstrate its accuracy on benchmark datasets  and we apply it to analyze a metagenomic dataset for species fingerprinting  finding a surprisingly small ID  of order  . This suggests that evolutive pressure acts on a low dimensional manifold despite the high dimensionality of sequences  space.,0
Universal Adversarial Triggers for Attacking and Analyzing NLP Adversarial examples highlight model vulnerabilities and are useful for evaluation and interpretation. We define universal adversarial triggers  input agnostic sequences of tokens that trigger a model to produce a specific prediction when concatenated to any input from a dataset. We propose a gradient guided search over tokens which finds short trigger sequences  e.g.  one word for classification and four words for language modeling  that successfully trigger the target prediction. For example  triggers cause SNLI entailment accuracy to drop from   .    to  .         of  why  questions in SQuAD to be answered  to kill american people   and the GPT   language model to spew racist output even when conditioned on non racial contexts. Furthermore  although the triggers are optimized using white box access to a specific model  they transfer to other models for all tasks we consider. Finally  since triggers are input agnostic  they provide an analysis of global model behavior. For instance  they confirm that SNLI models exploit dataset biases and help to diagnose heuristics learned by reading comprehension models.,0
Adversarial Training for High Stakes Reliability In the future  powerful AI systems may be deployed in high stakes settings  where a single failure could be catastrophic. One technique for improving AI safety in high stakes settings is adversarial training  which uses an adversary to generate examples to train on in order to achieve better worst case performance.,0
Towards Evaluating the Robustness of Neural Networks Neural networks provide state of the art results for most machine learning tasks. Unfortunately  neural networks are vulnerable to adversarial examples  given an input  x  and any target classification  t   it is possible to find a new input  x   that is similar to  x  but classified as  t . This makes it difficult to apply neural networks in security critical areas. Defensive distillation is a recently proposed approach that can take an arbitrary neural network  and increase its robustness  reducing the success rate of current attacks  ability to find adversarial examples from        to   .    .,0
Towards Deep Learning Models Resistant to Adversarial Attacks Recent work has demonstrated that deep neural networks are vulnerable to adversarial examples   inputs that are almost indistinguishable from natural data and yet classified incorrectly by the network. In fact  some of the latest findings suggest that the existence of adversarial attacks may be an inherent weakness of deep learning models. To address this problem  we study the adversarial robustness of neural networks through the lens of robust optimization. This approach provides us with a broad and unifying view on much of the prior work on this topic. Its principled nature also enables us to identify methods for both training and attacking neural networks that are reliable and  in a certain sense  universal. In particular  they specify a concrete security guarantee that would protect against any adversary. These methods let us train networks with significantly improved resistance to a wide range of adversarial attacks. They also suggest the notion of security against a first order adversary as a natural and broad security guarantee. We believe that robustness against such well defined classes of adversaries is an important stepping stone towards fully resistant deep learning models. Code and pre trained models are available at,0
PixMix  Dreamlike Pictures Comprehensively Improve Safety Measures In real world applications of machine learning  reliable and safe systems must consider measures of performance beyond standard test set accuracy. These other goals include out of distribution  OOD  robustness  prediction consistency  resilience to adversaries  calibrated uncertainty estimates  and the ability to detect anomalous inputs. However  improving performance towards these goals is often a balancing act that today s methods cannot achieve without sacrificing performance on other safety axes. For instance  adversarial training improves adversarial robustness but sharply degrades other classifier performance metrics. Similarly  strong data augmentation and regularization techniques often improve OOD robustness but harm anomaly detection  raising the question of whether a Pareto improvement on all existing safety measures is possible. To meet this challenge  we design a new data augmentation strategy utilizing the natural structural complexity of pictures such as fractals  which outperforms numerous baselines  is near Pareto optimal  and roundly improves safety measures.,0
ImageNet trained CNNs are biased towards texture  increasing shape bias improves accuracy and robustness Convolutional Neural Networks  CNNs  are commonly thought to recognise objects by learning increasingly complex representations of object shapes. Some recent studies suggest a more important role of image textures. We here put these conflicting hypotheses to a quantitative test by evaluating CNNs and human observers on images with a texture shape cue conflict. We show that ImageNet trained CNNs are strongly biased towards recognising textures rather than shapes  which is in stark contrast to human behavioural evidence and reveals fundamentally different classification strategies. We then demonstrate that the same standard architecture  ResNet     that learns a texture based representation on ImageNet is able to learn a shape based representation instead when trained on  Stylized ImageNet   a stylized version of ImageNet. This provides a much better fit for human behavioural performance in our well controlled psychophysical lab setting  nine experiments totalling        psychophysical trials across    observers  and comes with a number of unexpected emergent benefits such as improved object detection performance and previously unseen robustness towards a wide range of image distortions  highlighting advantages of a shape based representation.,0
