text,label
AGBoost  Attention based Modification of Gradient Boosting Machine A new attention based model for the gradient boosting machine  GBM  called AGBoost  the attention based gradient boosting  is proposed for solving regression problems. The main idea behind the proposed AGBoost model is to assign attention weights with trainable parameters to iterations of GBM under condition that decision trees are base learners in GBM. Attention weights are determined by applying properties of decision trees and by using the Huber s contamination model which provides an interesting linear dependence between trainable parameters of the attention and the attention weights. This peculiarity allows us to train the attention weights by solving the standard quadratic optimization problem with linear constraints. The attention weights also depend on the discount factor as a tuning parameter  which determines how much the impact of the weight is decreased with the number of iterations. Numerical experiments performed for two types of base learners  original decision trees and extremely randomized trees with various regression datasets illustrate the proposed model.,1
Jackknife Variability Estimation For Randomized Matrix Computations Randomized algorithms based on sketching have become a workhorse tool in low rank matrix approximation. To use these algorithms safely in applications  they should be coupled with diagnostics to assess the quality of approximation. To meet this need  this paper proposes a jackknife resampling method to estimate the variability of the output of a randomized matrix computation. The variability estimate can recognize that a computation requires additional data or that the computation is intrinsically unstable. As examples  the paper studies jackknife estimates for two randomized low rank matrix approximation algorithms. In each case  the operation count for the jackknife estimate is independent of the dimensions of the target matrix. In numerical experiments  the estimator accurately assesses variability and also provides an order of magnitude estimate of the mean square error.,1
The role of the geometric mean in case control studies Historically used in settings where the outcome is rare or data collection is expensive  outcome dependent sampling is relevant to many modern settings where data is readily available for a biased sample of the target population  such as public administrative data. Under outcome dependent sampling  common effect measures such as the average risk difference and the average risk ratio are not identified  but the conditional odds ratio is. Aggregation of the conditional odds ratio is challenging since summary measures are generally not identified. Furthermore  the marginal odds ratio can be larger  or smaller  than all conditional odds ratios. This so called non collapsibility of the odds ratio is avoidable if we use an alternative aggregation to the standard arithmetic mean. We provide a new definition of collapsibility that makes this choice of aggregation method explicit  and we demonstrate that the odds ratio is collapsible under geometric aggregation. We describe how to partially identify  estimate  and do inference on the geometric odds ratio under outcome dependent sampling. Our proposed estimator is based on the efficient influence function and therefore has doubly robust style properties.,1
Variance estimation in graphs with the fused lasso We study the problem of variance estimation in general graph structured problems. First  we develop a linear time estimator for the homoscedastic case that can consistently estimate the variance in general graphs. We show that our estimator attains minimax rates for the chain and  D grid graphs when the mean signal has a total variation with canonical scaling. Furthermore  we provide general upper bounds on the mean squared error performance of the fused lasso estimator in general graphs under a moment condition and a bound on the tail behavior of the errors. These upper bounds allow us to generalize for broader classes of distributions  such as sub Exponential  many existing results on the fused lasso that are only known to hold with the assumption that errors are sub Gaussian random variables. Exploiting our upper bounds  we then study a simple total variation regularization estimator for estimating the signal of variances in the heteroscedastic case. Our results show that the variance estimator attains minimax rates for estimating signals of bounded variation in grid graphs   K  nearest neighbor graphs with very mild assumptions  and it is consistent for estimating the variances in any connected graph. In addition  extensive numerical results show that our proposed estimators perform reasonably well in a variety of graph structured models.,1
Better Methods and Theory for Federated Learning  Compression  Client Selection and Heterogeneity Federated learning  FL  is an emerging machine learning paradigm involving multiple clients  e.g.  mobile phone devices  with an incentive to collaborate in solving a machine learning problem coordinated by a central server. FL was proposed in      by Kone n  et al. and McMahan et al. as a viable privacy preserving alternative to traditional centralized machine learning since  by construction  the training data points are decentralized and never transferred by the clients to a central server. Therefore  to a certain degree  FL mitigates the privacy risks associated with centralized data collection.,1
Reliable amortized variational inference with physics based latent distribution correction Bayesian inference for high dimensional inverse problems is challenged by the computational costs of the forward operator and the selection of an appropriate prior distribution. Amortized variational inference addresses these challenges where a neural network is trained to approximate the posterior distribution over existing pairs of model and data. When fed previously unseen data and normally distributed latent samples as input  the pretrained deep neural network    in our case a conditional normalizing flow    provides posterior samples with virtually no cost. However  the accuracy of this approach relies on the availability of high fidelity training data  which seldom exists in geophysical inverse problems due to the heterogeneous structure of the Earth. In addition  accurate amortized variational inference requires the observed data to be drawn from the training data distribution. As such  we propose to increase the resilience of amortized variational inference when faced with data distribution shift via a physics based correction to the conditional normalizing flow latent distribution. To accomplish this  instead of a standard Gaussian latent distribution  we parameterize the latent distribution by a Gaussian distribution with an unknown mean and diagonal covariance. These unknown quantities are then estimated by minimizing the Kullback Leibler divergence between the corrected and true posterior distributions. While generic and applicable to other inverse problems  by means of a seismic imaging example  we show that our correction step improves the robustness of amortized variational inference with respect to changes in number of source experiments  noise variance  and shifts in the prior distribution. This approach provides a seismic image with limited artifacts and an assessment of its uncertainty with approximately the same cost as five reverse time migrations.,1
Fully Decentralized Model based Policy Optimization for Networked Systems Reinforcement learning algorithms require a large amount of samples  this often limits their real world applications on even simple tasks. Such a challenge is more outstanding in multi agent tasks  as each step of operation is more costly requiring communications or shifting or resources. This work aims to improve data efficiency of multi agent control by model based learning. We consider networked systems where agents are cooperative and communicate only locally with their neighbors  and propose the decentralized model based policy optimization framework  DMPO . In our method  each agent learns a dynamic model to predict future states and broadcast their predictions by communication  and then the policies are trained under the model rollouts. To alleviate the bias of model generated data  we restrain the model usage for generating myopic rollouts  thus reducing the compounding error of model generation. To pertain the independence of policy update  we introduce extended value function and theoretically prove that the resulting policy gradient is a close approximation to true policy gradients. We evaluate our algorithm on several benchmarks for intelligent transportation systems  which are connected autonomous vehicle control tasks  Flow and CACC  and adaptive traffic signal control  ATSC . Empirically results show that our method achieves superior data efficiency and matches the performance of model free methods using true models.,1
Multi Study Boosting  Theoretical Considerations for Merging vs. Ensembling Cross study replicability is a powerful model evaluation criterion that emphasizes generalizability of predictions. When training cross study replicable prediction models  it is critical to decide between merging and treating the studies separately. We study boosting algorithms in the presence of potential heterogeneity in predictor outcome relationships across studies and compare two multi study learning strategies     merging all the studies and training a single model  and    multi study ensembling  which involves training a separate model on each study and ensembling the resulting predictions. In the regression setting  we provide theoretical guidelines based on an analytical transition point to determine whether it is more beneficial to merge or to ensemble for boosting with linear learners. In addition  we characterize a bias variance decomposition of estimation error for boosting with component wise linear learners. We verify the theoretical transition point result in simulation and illustrate how it can guide the decision on merging vs. ensembling in an application to breast cancer gene expression data.,1
Contextual Bandits with Large Action Spaces  Made Practical A central problem in sequential decision making is to develop algorithms that are practical and computationally efficient  yet support the use of flexible  general purpose models. Focusing on the contextual bandit problem  recent progress provides provably efficient algorithms with strong empirical performance when the number of possible alternatives   actions   is small  but guarantees for decision making in large  continuous action spaces have remained elusive  leading to a significant gap between theory and practice. We present the first efficient  general purpose algorithm for contextual bandits with continuous  linearly structured action spaces. Our algorithm makes use of computational oracles for  i  supervised learning  and  ii  optimization over the action space  and achieves sample complexity  runtime  and memory independent of the size of the action space. In addition  it is simple and practical. We perform a large scale empirical evaluation  and show that our approach typically enjoys superior performance and efficiency compared to standard baselines.,1
The Union of Manifolds Hypothesis and its Implications for Deep Generative Modelling Deep learning has had tremendous success at learning low dimensional representations of high dimensional data. This success would be impossible if there was no hidden low dimensional structure in data of interest  this existence is posited by the manifold hypothesis  which states that the data lies on an unknown manifold of low intrinsic dimension. In this paper  we argue that this hypothesis does not properly capture the low dimensional structure typically present in data. Assuming the data lies on a single manifold implies intrinsic dimension is identical across the entire data space  and does not allow for subregions of this space to have a different number of factors of variation. To address this deficiency  we put forth the union of manifolds hypothesis  which accommodates the existence of non constant intrinsic dimensions. We empirically verify this hypothesis on commonly used image datasets  finding that indeed  intrinsic dimension should be allowed to vary. We also show that classes with higher intrinsic dimensions are harder to classify  and how this insight can be used to improve classification accuracy. We then turn our attention to the impact of this hypothesis in the context of deep generative models  DGMs . Most current DGMs struggle to model datasets with several connected components and or varying intrinsic dimensions. To tackle these shortcomings  we propose clustered DGMs  where we first cluster the data and then train a DGM on each cluster. We show that clustered DGMs can model multiple connected components with different intrinsic dimensions  and empirically outperform their non clustered counterparts without increasing computational requirements.,1
A New Index for Clustering Evaluation Based on Density Estimation A new index for internal evaluation of clustering is introduced. The index is defined as a mixture of two sub indices. The first sub index   I a   is called the Ambiguous Index  the second sub index   I s   is called the Similarity Index. Calculation of the two sub indices is based on density estimation to each cluster of a partition of the data. An experiment is conducted to test the performance of the new index  and compared with three popular internal clustering evaluation indices    Calinski Harabasz index  Silhouette coefficient  and Davies Bouldin index  on a set of     datasets. The result shows the new index improves the three popular indices by           and      correspondingly.,1
When does SGD favor flat minima  A quantitative characterization via linear stability The observation that stochastic gradient descent  SGD  favors flat minima has played a fundamental role in understanding implicit regularization of SGD and guiding the tuning of hyperparameters. In this paper  we provide a quantitative explanation of this striking phenomenon by relating the particular noise structure of SGD to its  emph linear stability   Wu et al.       . Specifically  we consider training over parameterized models with square loss. We prove that if a global minimum   theta    is linearly stable for SGD  then it must satisfy    H  theta      F leq O  sqrt B   eta    where    H  theta      F  B  eta  denote the Frobenius norm of Hessian at   theta     batch size  and learning rate  respectively. Otherwise  SGD will escape from that minimum  emph exponentially  fast. Hence  for minima accessible to SGD  the flatness    as measured by the Frobenius norm of the Hessian    is bounded independently of the model size and sample size. The key to obtaining these results is exploiting the particular geometry awareness of SGD noise     the noise magnitude is proportional to loss value     the noise directions concentrate in the sharp directions of local landscape. This property of SGD noise provably holds for linear networks and random feature models  RFMs  and is empirically verified for nonlinear networks. Moreover  the validity and practical relevance of our theoretical findings are justified by extensive numerical experiments.,1
Feed Forward Source Free Latent Domain Adaptation via Cross Attention We study the highly practical but comparatively under studied problem of latent domain adaptation  where a source model should be adapted to a target dataset that contains a mixture of unlabelled domain relevant and domain irrelevant examples. Furthermore  motivated by the requirements for data privacy and the need for embedded and resource constrained devices of all kinds to adapt to local data distributions  we focus on the setting of feed forward source free domain adaptation  where adaptation should not require access to the source dataset  and also be back propagation free. Our solution is to meta learn a network capable of embedding the mixed relevance target dataset and dynamically adapting inference for target examples using cross attention. The resulting framework leads to consistent improvement on strong ERM baselines. We also show that our framework sometimes even improves on the upper bound of domain supervised adaptation  where only domain relevant instances are provided for adaptation. This suggests that human annotated domain labels may not always be optimal  and raises the possibility of doing better through automated instance selection.,1
Uncertainty quantification for predictions of atomistic neural networks The value of uncertainty quantification on predictions for trained neural networks  NNs  on quantum chemical reference data is quantitatively explored. For this  the architecture of the PhysNet NN was suitably modified and the resulting model was evaluated with different metrics to quantify calibration  quality of predictions  and whether prediction error and the predicted uncertainty can be correlated. The results from training on the QM  database and evaluating data from the test set within and outside the distribution indicate that error and uncertainty are not linearly related. The results clarify that noise and redundancy complicate property prediction for molecules even in cases for which changes   e.g. double bond migration in two otherwise identical molecules   are small. The model was then applied to a real database of tautomerization reactions. Analysis of the distance between members in feature space combined with other parameters shows that redundant information in the training dataset can lead to large variances and small errors whereas the presence of similar but unspecific information returns large errors but small variances. This was  e.g.  observed for nitro containing aliphatic chains for which predictions were difficult although the training set contained several examples for nitro groups bound to aromatic molecules. This underlines the importance of the composition of the training data and provides chemical insight into how this affects the prediction capabilities of a ML model. Finally  the approach put forward can be used for information based improvement of chemical databases for target applications through active learning optimization.,1
Learning structures of the French clinical language development and validation of word embedding models using    million clinical reports from electronic health records Background,1
Forget me not  Contrastive Critics for Mitigating Posterior Collapse Variational autoencoders  VAEs  suffer from posterior collapse  where the powerful neural networks used for modeling and inference optimize the objective without meaningfully using the latent representation. We introduce inference critics that detect and incentivize against posterior collapse by requiring correspondence between latent variables and the observations. By connecting the critic s objective to the literature in self supervised contrastive representation learning  we show both theoretically and empirically that optimizing inference critics increases the mutual information between observations and latents  mitigating posterior collapse. This approach is straightforward to implement and requires significantly less training time than prior methods  yet obtains competitive results on three established datasets. Overall  the approach lays the foundation to bridge the previously disconnected frameworks of contrastive learning and probabilistic modeling with variational autoencoders  underscoring the benefits both communities may find at their intersection.,1
Conservative SPDEs as fluctuating mean field limits of stochastic gradient descent The convergence of stochastic interacting particle systems in the mean field limit to solutions to conservative stochastic partial differential equations is shown  with optimal rate of convergence. As a second main result  a quantitative central limit theorem for such SPDEs is derived  again with optimal rate of convergence.,1
Uncertainty Calibration in Bayesian Neural Networks via Distance Aware Priors As we move away from the data  the predictive uncertainty should increase  since a great variety of explanations are consistent with the little available information. We introduce Distance Aware Prior  DAP  calibration  a method to correct overconfidence of Bayesian deep learning models outside of the training domain. We define DAPs as prior distributions over the model parameters that depend on the inputs through a measure of their distance from the training set. DAP calibration is agnostic to the posterior inference method  and it can be performed as a post processing step. We demonstrate its effectiveness against several baselines in a variety of classification and regression problems  including benchmarks designed to test the quality of predictive distributions away from the data.,1
Predicting Out of Domain Generalization with Local Manifold Smoothness Understanding how machine learning models generalize to new environments is a critical part of their safe deployment. Recent work has proposed a variety of complexity measures that directly predict or theoretically bound the generalization capacity of a model. However  these methods rely on a strong set of assumptions that in practice are not always satisfied. Motivated by the limited settings in which existing measures can be applied  we propose a novel complexity measure based on the local manifold smoothness of a classifier. We define local manifold smoothness as a classifier s output sensitivity to perturbations in the manifold neighborhood around a given test point. Intuitively  a classifier that is less sensitive to these perturbations should generalize better. To estimate smoothness we sample points using data augmentation and measure the fraction of these points classified into the majority class. Our method only requires selecting a data augmentation method and makes no other assumptions about the model or data distributions  meaning it can be applied even in out of domain  OOD  settings where existing methods cannot. In experiments on robustness benchmarks in image classification  sentiment analysis  and natural language inference  we demonstrate a strong and robust correlation between our manifold smoothness measure and actual OOD generalization on over       models evaluated on over     train test domain pairs.,1
Discrimination in machine learning algorithms Machine learning algorithms are routinely used for business decisions that may directly affect individuals  for example  because a credit scoring algorithm refuses them a loan. It is then relevant from an ethical  and legal  point of view to ensure that these algorithms do not discriminate based on sensitive attributes  like sex or race   which may occur unwittingly and unknowingly by the operator and the management. Statistical tools and methods are then required to detect and eliminate such potential biases.,1
Learning Optimal Transport Between two Empirical Distributions with Normalizing Flows Optimal transport  OT  provides effective tools for comparing and mapping probability measures. We propose to leverage the flexibility of neural networks to learn an approximate optimal transport map. More precisely  we present a new and original method to address the problem of transporting a finite set of samples associated with a first underlying unknown distribution towards another finite set of samples drawn from another unknown distribution. We show that a particular instance of invertible neural networks  namely the normalizing flows  can be used to approximate the solution of this OT problem between a pair of empirical distributions. To this aim  we propose to relax the Monge formulation of OT by replacing the equality constraint on the push forward measure by the minimization of the corresponding Wasserstein distance. The push forward operator to be retrieved is then restricted to be a normalizing flow which is trained by optimizing the resulting cost function. This approach allows the transport map to be discretized as a composition of functions. Each of these functions is associated to one sub flow of the network  whose output provides intermediate steps of the transport between the original and target measures. This discretization yields also a set of intermediate barycenters between the two measures of interest. Experiments conducted on toy examples as well as a challenging task of unsupervised translation demonstrate the interest of the proposed method. Finally  some experiments show that the proposed approach leads to a good approximation of the true OT.,1
